{
  "schema_version": "1.0",
  "master_image": "@原图(温泉庭院夜戏参考图)",
  "total_duration": 30,
  "visual_lock": {
    "color": "深青黑色夜景基底;潮湿青绿暗部;偏橙红铜色灯火;人物肤色受暖色侧逆光照亮;水面深青黑反射零碎橙色高光;低饱和低反差,高光柔和晕开",
    "texture": "90年代香港古装电影摄影质感;轻微柔焦;老式镜头halation;细腻胶片颗粒;微弱色散;轻微运动拖影;潮湿空气;大量真实蒸汽;灯笼光穿雾成朦胧光柱",
    "space_rule": "镜头移出画面只允许合理外延同一座庭院,禁止另造建筑/改时代/现代元素"
  },
  "cast": [
    { "id": "A", "role": "冷面吐槽姐(女子甲)", "voice": "声线稍低清冷柔和,说话略慢,嘴上不饶人但带笑" },
    { "id": "B", "role": "手快嘴快姐(女子乙)", "voice": "声线明亮,语速最快,爱抢话,笑声明显,性格活泼" },
    { "id": "C", "role": "温柔拱火姐(女子丙)", "voice": "声音温柔成熟,一直带笑,看似劝架实则拱火" },
    { "id": "D", "role": "耳语军师(女子丁)", "voice": "声音较轻,贴耳讲话,语气促狭" },
    { "id": "E", "role": "氛围组1", "voice": "自然笑声/惊呼/零碎插话" },
    { "id": "F", "role": "氛围组2", "voice": "自然笑声/惊呼/零碎插话" }
  ],
  "storyline": "夜泡温泉六姐妹嘴仗升级成嬉水混战,耳语军师挑火,最后闹完安静和解。",
  "segments": [
    {
      "id": 1,
      "timecode": "00:00-00:06",
      "function": "先闻笑声,再见其人",
      "lens": "35mm",
      "shot_size": "远景",
      "camera": "从距池15-20米庭院暗侧沿湿润小径极缓慢推进,带老电影手持漂浮感;前景虚焦竹叶/屋檐/纱帐",
      "action": [
        "画面深处六名女子身形较小,嬉笑拨水,看不清是谁讲话",
        "有人拨水,有人侧身说话,有人笑着躲开另一人的手",
        "蒸汽横向飘过,竹叶掠过画面,灯笼微闪"
      ],
      "dialogue": [
        { "who": "B(远处)", "text": "阿姊,你莫躲呀——", "interrupt": "带庭院混响" },
        { "who": "A(抢话)", "text": "分明是你先——", "interrupt": "被水花声打断,随后错落笑起" }
      ],
      "sfx": "远距离笑声混响/泉水流动/夜虫/竹叶沙沙",
      "visual_note": "与@原图同一庭院同一色调;人物小,声音远"
    },
    {
      "id": 2,
      "timecode": "00:06-00:11",
      "function": "进入她们的世界",
      "lens": "35-40mm",
      "shot_size": "中远景",
      "camera": "继续缓慢向前并极轻微向右漂移,由远景自然进入,不跳切",
      "action": [
        "A被水泼中,闭眼本能缩肩,用手抹去脸上水珠,抬眼看向B",
        "A忍笑回话,B抢话时自己忍不住笑",
        "C带笑插话,身后另一人轻笑,一人在水下悄悄拨水"
      ],
      "dialogue": [
        { "who": "A", "text": "好大胆子,竟敢欺我。", "interrupt": "话尾未落" },
        { "who": "B", "text": "何谓欺你?兵不厌诈。", "interrupt": "自己先笑" },
        { "who": "C", "text": "你还同她讲兵法?", "interrupt": "背景轻笑" }
      ],
      "sfx": "对白清晰但泉水/竹叶/虫鸣仍在,非棚内配音",
      "visual_note": "人物距镜头3-6米;环境声不压过对白"
    },
    {
      "id": 3,
      "timecode": "00:11-00:16",
      "function": "嘴仗",
      "lens": "50-65mm",
      "shot_size": "中景",
      "camera": "中央三名女子,仅轻微横向漂移与呼吸感,不锁死",
      "action": [
        "C笑着劝架,A低头拨水漫不经心回",
        "B马上接话;C说完后背景有人偷笑",
        "A转头只说一个'你'字,B突然掬水泼去,水声盖住后半句",
        "A本能闭眼侧头,停半拍后自己笑出来,水滴沿脸侧湿发落下"
      ],
      "dialogue": [
        { "who": "C", "text": "二位若再闹,这一池汤怕真要沸了。", "interrupt": "" },
        { "who": "A", "text": "本就是热的。", "interrupt": "" },
        { "who": "B", "text": "她最会强词夺理。", "interrupt": "马上接" },
        { "who": "A", "text": "你——", "interrupt": "被水声完全覆盖" }
      ],
      "sfx": "强抢话节拍;背景低声交谈模糊词,不出完整对白",
      "visual_note": "三人抢话不轮流等待"
    },
    {
      "id": 4,
      "timecode": "00:16-00:21",
      "function": "有人开始使坏",
      "lens": "85mm",
      "shot_size": "中近景",
      "camera": "移向温泉另一侧,隔着半透明纱帐/竹叶/木柱偷窥式观察;前景纱帐虚焦,夜风偶尔遮脸",
      "action": [
        "D贴近A耳边压低声音说话,A不转头只轻应",
        "A慢慢看向池另一边的B,微微眯眼",
        "D低头忍笑;B浑然不知仍与别人说话"
      ],
      "dialogue": [
        { "who": "D", "text": "阿姊。", "interrupt": "耳语气声" },
        { "who": "A", "text": "嗯?", "interrupt": "" },
        { "who": "D", "text": "她方才说你输不起。", "interrupt": "憋笑" },
        { "who": "A", "text": "当真?", "interrupt": "" },
        { "who": "D", "text": "我岂敢诓你。", "interrupt": "低头偷笑" }
      ],
      "sfx": "因隔纱帐与蒸汽,人声比上一镜略柔",
      "visual_note": "说完停半秒再行动;背景模糊话语被水声盖过"
    },
    {
      "id": 5,
      "timecode": "00:21-00:26",
      "function": "嬉水高潮",
      "lens": "35mm",
      "shot_size": "全景-中景",
      "camera": "从侧面沿温泉池短距离自然弧形移动,略快但仍是电影摄影,非运动相机感",
      "action": [
        "A突然毫无预兆向B掬水泼去,B本能侧身闭眼挡水",
        "A边退边把'兵不厌诈'原话奉还,B愣半拍指她笑,话没说完立刻反击",
        "B的水没打中A却误伤C;C顿住低头看自己,刚开口又被水花打断,随即加入",
        "戏从两人扩到三四人;动作各不相同:有人后退有人挡脸有人偷泼有人只笑",
        "水花在暖色逆光中闪成光珠,湿发甩动,薄纱轻动,水面剧烈涟漪,允许少量真实运动模糊"
      ],
      "dialogue": [
        { "who": "B", "text": "呀!/你怎又来!", "interrupt": "被泼" },
        { "who": "A", "text": "兵不厌诈。", "interrupt": "奉还原话" },
        { "who": "B", "text": "好哇你——", "interrupt": "话没说完反击" },
        { "who": "C", "text": "哎!怎么连我也——", "interrupt": "被水花打断" },
        { "who": "众人", "text": "莫泼我!/好哇!/休逃!/你等着——", "interrupt": "零碎不全" }
      ],
      "sfx": "全片音量峰值;水花盖台词;笑声来自不同位置,有大笑/短笑/先惊叫再笑,严禁齐声笑",
      "visual_note": "人物面孔仍清楚;群体动作禁止同步"
    },
    {
      "id": 6,
      "timecode": "00:26-00:30",
      "function": "闹完以后突然安静",
      "lens": "35-40mm",
      "shot_size": "群像",
      "camera": "逐渐回到接近@原图的群像构图,镜头运动慢下来至渐稳",
      "action": [
        "最后几下水花结束,前1-1.5秒无正式对白",
        "A拨湿发到耳后,C低头笑,有人扶池边轻喘",
        "C带无奈的笑总结,B很小声嘀咕,A转头,B边笑认输",
        "对白消失,灯笼暖光穿蒸汽成柔和橙红光晕,画面保持一瞬自然结束"
      ],
      "dialogue": [
        { "who": "C", "text": "好了好了,再闹下去,明日可都要病了。", "interrupt": "" },
        { "who": "B", "text": "都是她先动手的。", "interrupt": "小声嘀咕" },
        { "who": "A", "text": "你还说?", "interrupt": "" },
        { "who": "B", "text": "不说了,不说了。", "interrupt": "边笑边认输" }
      ],
      "sfx": "尾声1-1.5s无对白:喘气/滴水/波纹/夜虫/竹叶/轻笑;禁止再次大爆笑",
      "visual_note": "不同人不同程度的轻笑"
    }
  ]
}
